{
  "$schema": "./stack-v0.schema.json",
  "schemaVersion": 1,
  "stackVersion": "0.1.0-local.7",
  "status": "activated-local-only-hold",
  "ownerIssue": 113,
  "sources": {
    "selection": {
      "path": "chain/explorer/selection-v1.json",
      "ownerIssue": 112,
      "selectionVersion": "1.0.0-local.3"
    },
    "nodeRoles": {
      "path": "chain/profiles/node-roles-v0.json",
      "ownerIssue": 114,
      "profileVersion": "0.1.0-local.2"
    }
  },
  "constraints": {
    "environment": "local-development-only",
    "activated": false,
    "composeOrRuntimeConfigIncluded": false,
    "liveDeploymentAllowed": false,
    "publicOperationAllowed": false,
    "publicEndpointsAllowed": false,
    "loopbackHostPublishingOnly": true,
    "toriumBackendIntegrationInScope": false,
    "toriumBackendAuthorityAllowed": false,
    "chainRpcAuthority": "authoritative",
    "explorerDatabaseAuthority": "derived-rebuildable-index"
  },
  "selectionContract": {
    "name": "Blockscout",
    "repository": "https://github.com/blockscout/blockscout",
    "release": "v11.2.2",
    "commit": "731015d88d7e73623f2a3c097e241bc82b04ea7a",
    "distribution": "exact-commit-source-build",
    "prebuiltImageAccepted": false,
    "localImageTag": "torium/blockscout-poc:v11.2.2",
    "localImageTagIsSecurityIdentity": false,
    "license": "LicenseRef-Blockscout-1.0",
    "internalTransactionsEnabled": false,
    "requiredTraceMethods": []
  },
  "archiveGatewayContract": {
    "gatewayId": "archive-indexer-v0",
    "status": "activated-local-private-sidecar",
    "consumerIdentity": "blockscout",
    "consumerNetwork": "archive-indexer-consumer",
    "rawUpstreamNetwork": "archive-raw-rpc",
    "rawRpcReachableFromConsumer": false,
    "runtimePolicyRef": "evm-archive-blockscout-candidate-v0",
    "enforcedContractField": "candidateMethodContract",
    "httpEndpoint": "http://archive-rpc-gateway:8545",
    "webSocketEndpoint": "ws://archive-rpc-gateway:8546",
    "loopbackHttpReservation": "127.0.0.1:38545",
    "loopbackWebSocketReservation": "127.0.0.1:38546",
    "activated": true,
    "effectiveConformanceProven": true
  },
  "network": {
    "networks": [
      {
        "id": "explorer-data",
        "members": [
          "postgresql",
          "redis",
          "blockscout-migrations",
          "blockscout-backend-api",
          "blockscout-indexer"
        ],
        "consumerPublishedToHost": false
      },
      {
        "id": "archive-indexer-consumer",
        "members": [
          "archive-rpc-gateway",
          "blockscout-indexer"
        ],
        "consumerPublishedToHost": false
      },
      {
        "id": "explorer-ui",
        "members": [
          "blockscout-backend-api",
          "blockscout-frontend"
        ],
        "consumerPublishedToHost": false
      }
    ],
    "hostReservations": [
      {
        "owner": "blockscout-backend-api",
        "binding": "127.0.0.1:44000",
        "status": "reserved-not-activated"
      },
      {
        "owner": "blockscout-frontend",
        "binding": "127.0.0.1:44001",
        "status": "reserved-not-activated"
      },
      {
        "owner": "archive-rpc-gateway-http",
        "binding": "127.0.0.1:38545",
        "status": "published-by-activated-114-gateway"
      },
      {
        "owner": "archive-rpc-gateway-websocket",
        "binding": "127.0.0.1:38546",
        "status": "published-by-activated-114-gateway"
      }
    ],
    "postgresPublishedToHost": false,
    "redisPublishedToHost": false,
    "rawArchiveRpcPublishedToHost": false,
    "publicIngressConfigured": false
  },
  "components": [
    {
      "id": "postgresql",
      "kind": "database",
      "requirement": "required-core",
      "targetEnabled": true,
      "activated": true,
      "artifact": {
        "sourceRepository": null,
        "sourceRelease": null,
        "sourceCommit": null,
        "localImageTag": null,
        "imageWithDigest": "postgres:17-alpine@sha256:dc17045ccfd343b49600570ea734b9c4991cf1c3f3302e67df51e3b402dd55c4",
        "immutablePinStatus": "exact-image-digest-approved"
      },
      "dependsOn": [],
      "networkMembership": [
        "explorer-data"
      ],
      "hostPublish": null,
      "readiness": {
        "probe": "pg_isready",
        "status": "reused-proof-not-stack-exercised"
      },
      "authority": "derived-rebuildable-index-storage"
    },
    {
      "id": "redis",
      "kind": "cache-and-queue",
      "requirement": "required-core",
      "targetEnabled": true,
      "activated": true,
      "artifact": {
        "sourceRepository": null,
        "sourceRelease": null,
        "sourceCommit": null,
        "localImageTag": null,
        "imageWithDigest": "redis:7.4-alpine@sha256:e7723ff73d963f5cc6d9c4643ea3d989527a402a319239054e9472a7fb9219a2",
        "immutablePinStatus": "exact-image-digest-approved"
      },
      "dependsOn": [],
      "networkMembership": [
        "explorer-data"
      ],
      "hostPublish": null,
      "readiness": {
        "probe": "redis-ping-contract-not-approved",
        "status": "HOLD-not-exercised"
      },
      "authority": "non-authoritative-ephemeral-cache"
    },
    {
      "id": "blockscout-migrations",
      "kind": "one-shot-database-migrations",
      "requirement": "required-core",
      "targetEnabled": true,
      "activated": true,
      "artifact": {
        "sourceRepository": "https://github.com/blockscout/blockscout",
        "sourceRelease": "v11.2.2",
        "sourceCommit": "731015d88d7e73623f2a3c097e241bc82b04ea7a",
        "localImageTag": "torium/blockscout-poc:v11.2.2",
        "imageWithDigest": "torium/blockscout-poc@sha256:af87ff261ac380bb91d65be4cad7bdebc6db0a748a20529776cd1f8fa64772c8",
        "immutablePinStatus": "exact-local-build-digest-approved"
      },
      "dependsOn": [
        "postgresql"
      ],
      "networkMembership": [
        "explorer-data"
      ],
      "hostPublish": null,
      "readiness": {
        "probe": "release-migration-command-exit-zero",
        "status": "reused-proof-command-not-stack-exercised"
      },
      "authority": "schema-mutation-only-no-chain-authority"
    },
    {
      "id": "blockscout-backend-api",
      "kind": "explorer-api-and-realtime-backend",
      "requirement": "required-core",
      "targetEnabled": true,
      "activated": true,
      "artifact": {
        "sourceRepository": "https://github.com/blockscout/blockscout",
        "sourceRelease": "v11.2.2",
        "sourceCommit": "731015d88d7e73623f2a3c097e241bc82b04ea7a",
        "localImageTag": "torium/blockscout-poc:v11.2.2",
        "imageWithDigest": "torium/blockscout-poc@sha256:af87ff261ac380bb91d65be4cad7bdebc6db0a748a20529776cd1f8fa64772c8",
        "immutablePinStatus": "exact-local-build-digest-approved"
      },
      "dependsOn": [
        "postgresql",
        "redis",
        "blockscout-migrations"
      ],
      "networkMembership": [
        "explorer-data",
        "explorer-ui"
      ],
      "hostPublish": "127.0.0.1:44000",
      "readiness": {
        "probe": "HOLD-exact-health-endpoint-contract-missing",
        "status": "HOLD-not-exercised"
      },
      "authority": "derived-api-from-chain-rpc-only"
    },
    {
      "id": "blockscout-indexer",
      "kind": "blocks-transactions-receipts-logs-indexers",
      "requirement": "required-core",
      "targetEnabled": true,
      "activated": true,
      "artifact": {
        "sourceRepository": "https://github.com/blockscout/blockscout",
        "sourceRelease": "v11.2.2",
        "sourceCommit": "731015d88d7e73623f2a3c097e241bc82b04ea7a",
        "localImageTag": "torium/blockscout-poc:v11.2.2",
        "imageWithDigest": "torium/blockscout-poc@sha256:af87ff261ac380bb91d65be4cad7bdebc6db0a748a20529776cd1f8fa64772c8",
        "immutablePinStatus": "exact-local-build-digest-approved"
      },
      "dependsOn": [
        "postgresql",
        "redis",
        "blockscout-migrations",
        "external:archive-rpc-gateway"
      ],
      "networkMembership": [
        "explorer-data",
        "archive-indexer-consumer"
      ],
      "hostPublish": null,
      "readiness": {
        "probe": "indexed-height-and-block-hash-reconciliation",
        "status": "HOLD-not-reconciled"
      },
      "authority": "derived-index-not-chain-authority"
    },
    {
      "id": "blockscout-frontend",
      "kind": "explorer-web-ui",
      "requirement": "required-ui",
      "targetEnabled": true,
      "activated": true,
      "artifact": {
        "sourceRepository": "https://github.com/blockscout/frontend",
        "sourceRelease": "v2.3.0",
        "sourceCommit": "e1111ee2f89af699e53f441340f5149ec153f6f3",
        "localImageTag": null,
        "imageWithDigest": "ghcr.io/blockscout/frontend@sha256:a8520de41d06772d0185e4737076d71629ebba3863fd07fece906544839ba321",
        "immutablePinStatus": "exact-image-digest-approved"
      },
      "dependsOn": [
        "blockscout-backend-api"
      ],
      "networkMembership": [
        "explorer-ui"
      ],
      "hostPublish": "127.0.0.1:44001",
      "readiness": {
        "probe": "GET /api/healthz plus GET /node-api/config reconciled against chain/config/identifiers.json and the canonical chain id, and GET / //txs //blocks rendering",
        "status": "exercised-locally-2026-07-30"
      },
      "authority": "presentation-only"
    },
    {
      "id": "smart-contract-verifier",
      "kind": "source-verification-service",
      "requirement": "required-for-issue-closure",
      "targetEnabled": false,
      "activated": false,
      "artifact": {
        "sourceRepository": "https://github.com/blockscout/blockscout-rs",
        "sourceRelease": "smart-contract-verifier-v1.10.5",
        "sourceCommit": "5cb8bdc88ebdbccf779bc138f1aeb8933b37eb07",
        "localImageTag": null,
        "imageWithDigest": "ghcr.io/blockscout/smart-contract-verifier@sha256:1747fec3d766818987a85f1bce25aef90bce7f3a43e6fad2597850d1cafb3ac1",